{
  "schema": "simplicity-damp-registry-v1",
  "protocol": "simplicity-damp/v0.2",
  "deploymentId": "038a20faeff85454049e234a089804f3b3710fdb07451747b4c1654acb9b6f9d",
  "sequence": 0,
  "parentPolicyRoot": null,
  "parentVerifierScriptHash": null,
  "treeDepth": 4,
  "setRoot": "36c614d3fcffdbdfe4baf66656fb17c8373bd42eb8aca046ec5b50ae8395f0cf",
  "entryCount": 0,
  "policyRoot": "57c67efc5b0b29e0a19c6129e472b269952b9bfa9390d709f0c4ab3989991fa1",
  "verifierProgramHash": "dc2d159c724a84d19f0561cfe1c5bd284131f50a72e49693de70cba23b2ad96b",
  "verifierScriptPubkey": "5120b4080fb7913a0254464cb0cd8b345f082f0f69ea5ac13b88b043021a5f7d7571",
  "entries": []
}
