{
  "schema": "simplicity-damp-registry-v1",
  "protocol": "simplicity-damp/v0.2",
  "deploymentId": "ef885297eaa75868748190579b5f91aeb9fd84c385a58858c39991965f04a373",
  "sequence": 0,
  "parentPolicyRoot": null,
  "parentVerifierScriptHash": null,
  "treeDepth": 4,
  "setRoot": "36c614d3fcffdbdfe4baf66656fb17c8373bd42eb8aca046ec5b50ae8395f0cf",
  "entryCount": 0,
  "policyRoot": "57c67efc5b0b29e0a19c6129e472b269952b9bfa9390d709f0c4ab3989991fa1",
  "verifierProgramHash": "be9dc0ab3418046779b0e63b4aacbb27828859280cf42d23cb353ec8335cbc9f",
  "verifierScriptPubkey": "5120903228cd15b1cba8abe43a4ce1f2d070f5dab41ecfd71b69232d63cb73c5b99c",
  "entries": []
}
