{
  "schema": "simplicity-damp-registry-v1",
  "protocol": "simplicity-damp/v0.2",
  "deploymentId": "2162f035a69c7fc05a03d8d84a59b701357a032409a049a566edb9a57c990b59",
  "sequence": 2,
  "parentPolicyRoot": "a1d0fc87d266508501e1ad08c8da725dee8afc52ee91d751e34eced1b437553a",
  "parentVerifierScriptHash": "2235ee89767cae2be5dd6c7606f27870bcc2d4dc16e778067048faaf71c4c654",
  "treeDepth": 4,
  "setRoot": "95642abbd2dba8dcac0cba1f5621c2729d1b754f4d24222ee9ab47328b7d18ad",
  "entryCount": 2,
  "policyRoot": "80ea4453a9f461de3977b584d57cfaa89067fc9088014897fa65ddb647c5a5da",
  "verifierProgramHash": "d09b1dc60c8fbc8419af3d4d1c125af6e128548f9c3eee5eee9315e2d4cba6ef",
  "verifierScriptPubkey": "51209e3a2bf020225c646c85fb349b93e1e7aaa2555bb3aa5028dd2e1f05316b10c1",
  "entries": [
    {
      "txid": "0c2a766ac267c94ef359b54e4b96b86f6c1b46f5a90d7371e16c310625203078",
      "vout": 1,
      "note": "Added from Report"
    },
    {
      "txid": "b8494927dc45fdf6fac09de9eb5b21311ff79dc08391c44b5f5ade82e8bf7f55",
      "vout": 1,
      "note": "Added from Report"
    }
  ]
}
