{
  "schema": "simplicity-damp-registry-v1",
  "protocol": "simplicity-damp/v0.2",
  "deploymentId": "ede04b098e07d6158cd12985218cfc28916a15d01542256fde7500ad5acd3a73",
  "sequence": 0,
  "parentPolicyRoot": null,
  "parentVerifierScriptHash": null,
  "treeDepth": 4,
  "setRoot": "36c614d3fcffdbdfe4baf66656fb17c8373bd42eb8aca046ec5b50ae8395f0cf",
  "entryCount": 0,
  "policyRoot": "57c67efc5b0b29e0a19c6129e472b269952b9bfa9390d709f0c4ab3989991fa1",
  "verifierProgramHash": "71bab029515da918fdae058b9d4a9ab4760d67da5c09e1df646aac6aa27dfae8",
  "verifierScriptPubkey": "51204b735c464a75cd9c3ea081e542c4a7633ac8e643c625241f7bf2e815c76dc66d",
  "entries": []
}
